{
  "$schema": "http://json-schema.org/draft-07/schema#",
  "$id": "https://robox-capital.internal/events/auth.mfa_enrollment_required.v1.json",
  "title": "auth.mfa_enrollment_required",
  "description": "Credenciales validas sin segundo factor configurado: se exige el alta de MFA antes de emitir sesion.",
  "type": "object",
  "required": [
    "eventId",
    "eventType",
    "eventVersion",
    "occurredAt",
    "producer",
    "payload"
  ],
  "additionalProperties": false,
  "properties": {
    "eventId": {
      "type": "string",
      "format": "uuid",
      "pattern": "^[0-9a-fA-F]{8}-[0-9a-fA-F]{4}-[0-9a-fA-F]{4}-[0-9a-fA-F]{4}-[0-9a-fA-F]{12}$"
    },
    "eventType": {
      "const": "auth.mfa_enrollment_required"
    },
    "eventVersion": {
      "const": 1
    },
    "occurredAt": {
      "type": "string",
      "format": "date-time"
    },
    "producer": {
      "type": "string",
      "enum": [
        "api-gateway",
        "quant-service"
      ]
    },
    "payload": {
      "type": "object",
      "required": [
        "userId",
        "email"
      ],
      "additionalProperties": false,
      "properties": {
        "userId": {
          "type": "string",
          "format": "uuid",
          "pattern": "^[0-9a-fA-F]{8}-[0-9a-fA-F]{4}-[0-9a-fA-F]{4}-[0-9a-fA-F]{4}-[0-9a-fA-F]{12}$"
        },
        "email": {
          "type": "string",
          "format": "email"
        }
      }
    }
  }
}
