{
  "eventId": "f130b6e8-fd09-41f3-b520-04dbeca07404",
  "eventType": "auth.mfa_enrollment_required",
  "eventVersion": 1,
  "occurredAt": "2026-08-24T09:00:00.000Z",
  "producer": "api-gateway",
  "payload": {
    "userId": "3f1c8a2e-9b7d-4c5a-8e1f-2d4b6a8c0e91",
    "email": "analista@robox.capital"
  }
}
